Detected macOS. Executing macOS metrics collection script.
Collecting memory usage on macOS...
Raw Values - Free Pages: 7043, Inactive Pages: 397322, Active Pages: 412836
Total RAM: 18432 MB
Used RAM: 12658 MB
Free RAM: 110 MB
Memory Health: Good
Page Size: 16384 bytes
Collecting CPU utilization on macOS...
Average CPU Utilization: 4.59%
CPU Health Status: Good

Retrieving CPU details...
CPU Brand: Apple M3 Pro
Number of Cores: 12
Logical Cores: 12
Current CPU Power for each core:
CPU Power: 382 mW
Attempting to retrieve current CPU frequency...
E-Cluster HW active frequency: 926 MHz
Checking GPU type...
GPU Type: Apple Silicon
==============================
   Collecting GPU Metrics     
==============================
==============================
         Parsed Metrics       
==============================
GPU Active Frequency: 0 MHz
GPU Active Residency: 0.00%
GPU Power Consumption: 0 mW
==============================
         GPU Health           
==============================
GPU Health: Idle (No activity detected)
GPU Load (Pressure): 0.00%
==============================
Collecting disk usage and SMART status on macOS...
Disk Usage: 7%
SMART Status: Verified
All SMART Attributes:
smartctl 7.4 2023-08-01 r5530 [Darwin 24.3.0 arm64] (local build)
Copyright (C) 2002-23, Bruce Allen, Christian Franke, www.smartmontools.org

=== START OF SMART DATA SECTION ===
SMART/Health Information (NVMe Log 0x02)
Critical Warning:                   0x00
Temperature:                        29 Celsius
Available Spare:                    100%
Available Spare Threshold:          99%
Percentage Used:                    2%
Data Units Read:                    76,266,980 [39.0 TB]
Data Units Written:                 95,340,200 [48.8 TB]
Host Read Commands:                 1,589,221,685
Host Write Commands:                909,762,774
Controller Busy Time:               0
Power Cycles:                       213
Power On Hours:                     563
Unsafe Shutdowns:                   11
Media and Data Integrity Errors:    0
Error Information Log Entries:      0
Disk Health: Good
Collecting network interface statistics on macOS...
Network Statistics:
llw0: No Packet Errors
bridge0: No Packet Errors
awdl0*: Packet Errors Detected
en0: Packet Errors Detected
en1: No Packet Errors
gif0*: No Packet Errors
en2: No Packet Errors
en3: No Packet Errors
en4: No Packet Errors
stf0*: No Packet Errors
en5: No Packet Errors
en8: No Packet Errors
anpi0: No Packet Errors
anpi1: No Packet Errors
anpi2: No Packet Errors
ap1: No Packet Errors

Checking network interface statuses...
Active Interfaces:
en0:
Network Interfaces Summary:
Error-Free Interfaces: gif0* stf0* anpi2 anpi0 anpi1 en4 en5 en8 en1 en2 en3 bridge0 ap1 llw0
Interfaces with Errors: en0 en0 en0 en0 awdl0* awdl0*
Running speed test...
Ping: 20.752 ms
Download: 31.32 Mbit/s
Upload: 13.37 Mbit/s
Pinging Google DNS to check connectivity...
Network Health: Good (Avg Latency: 9.849 ms)
Running traceroute...
 1  unifi (192.168.0.1)  8.446 ms  2.737 ms  2.680 ms
 2  192.168.1.1 (192.168.1.1)  3.147 ms  2.983 ms  2.947 ms
 3  197.167.208.1 (197.167.208.1)  5.801 ms  16.163 ms  6.367 ms
 4  172.18.125.109 (172.18.125.109)  4.987 ms
    172.18.125.113 (172.18.125.113)  5.415 ms
    172.18.125.101 (172.18.125.101)  6.099 ms
 5  172.18.163.125 (172.18.163.125)  7.319 ms
    172.18.163.121 (172.18.163.121)  22.021 ms  6.585 ms
 6  172.18.214.222 (172.18.214.222)  6.630 ms
    172.18.1.89 (172.18.1.89)  6.498 ms
    172.18.214.222 (172.18.214.222)  7.541 ms
 7  * * *
 8  * * *
 9  * * *
10  * * *
11  * * *
12  * * *
13  * * *
14  * * *
15  * * *
Collecting system load metrics on macOS...
Raw Load Avg Output:  2.07 4.05 4.85
System Load Average: 1 Min: 2.07, 5 Min: 4.05, 15 Min: 4.85
Number of CPU cores: 12
Load Health: Good


Total RAM: 18432 MB
Used RAM: 12658 MB
Free RAM: 110 MB
Average CPU Utilization: 4.59%
GPU Active Frequency: 0 MHz
GPU Active Residency: 0.00%
GPU Power Consumption: 0 mW
Disk Usage: 7%
Temperature: 29 Celsius
Percentage Used: 2%%
Ping: 20.752 ms
Download: 31.32 Mbit/s
Upload: 13.37 Mbit/s
Average Load: 4.05
